id,name,maker,variant,type,productType,strainType,thcPct,cbdPct,terpenes,genetics,countryOfOrigin,irradiationStatus,producerUseCases,producerNotes,sourceName,sourceUrl,sourceType,sourceCheckedAt,sourceLicense,sourceNotes,availabilityStatus,availabilityConfidence,availabilityCheckedAt,availabilitySourceName,availabilitySourceUrl,availabilityNotes,availabilitySignals
pure-sunfarms-pkk-21-1-flower,Pink Kush,Pure Sunfarms,,indica,flower,indica,21,1,Caryophyllene:44.1%|Bisabolol:13.3%|Humulene:12.7%|Linalool:10.4%,Kush (OG relative),Canada,,,Pure Sunfarms greenhouse flower with classic kush character and a heavy caryophyllene-led terpene profile.,4C Labs,https://4clabs.co/products/pink-kush/,official distributor product page,2026-04-01T00:00:00.000Z,,Updated terpene percentages and supporting facts from 4C Labs public product page,,,,,,,
pure-sunfarms-jfg-smalls-24-1-flower,Jet Fuel Gelato,Pure Sunfarms,Smalls,hybrid,flower,hybrid,24,1,Myrcene:29.1%|Caryophyllene:28.9%|Limonene:12.8%|Linalool:10.5%,Gelato 45 x High Octane OG x Jet Fuel G6,Canada,,,Pure Sunfarms cultivar with diesel-citrus heritage and a balanced myrcene/caryophyllene terpene profile.,4C Labs,https://4clabs.co/products/jet-fuel-gelato/,official distributor product page,2026-04-01T00:00:00.000Z,,Updated terpene percentages and supporting facts from 4C Labs public product page,,,,,,,
tgod-organic-maple-kush-23-1-flower,Organic Maple Kush,TGOD,,indica,flower,indica-dominant hybrid,23,1,Limonene:29.9%|Myrcene:23.3%|Caryophyllene:21.5%|Humulene:6.2%,Koloa Sunrise x GG4,Canada,NONE,,Certified organic TGOD flower grown in living soil with a tropical kush profile and limonene-forward terpene balance.,4C Labs,https://4clabs.co/products/organic-maple-kush/,official distributor product page,2026-04-01T00:00:00.000Z,,Added from 4C Labs public TGOD product page,,,,,,,
tgod-organic-cherry-mints-21-1-flower,Organic Cherry Mints,TGOD,,sativa,flower,sativa-dominant hybrid,21,1,Myrcene:66.2%|Caryophyllene:9.5%|Pinene:6.2%|Limonene:5.4%,Cherry AK-47 x Kush Mints #11,Canada,NONE,,Certified organic TGOD flower with berry-and-menthol character and a strongly myrcene-dominant terpene profile.,4C Labs,https://4clabs.co/products/organic-cherry-mints/,official distributor product page,2026-04-01T00:00:00.000Z,,Added from 4C Labs public TGOD product page,,,,,,,
tgod-organic-gold-butter-mac-24-1-flower,Organic Gold Butter Mac,TGOD,,hybrid,flower,indica-dominant hybrid,24,1,Limonene:41.5%|Caryophyllene:31.4%|Linalool:14.5%|Myrcene:10.8%,Peanut Butter Breath x MAC-1 x Quebec Gold,Canada,NONE,,Certified organic TGOD flower grown in living soil with a rich citrus-spice terpene mix led by limonene and caryophyllene.,4C Labs,https://4clabs.co/products/organic-gold-butter-mac/,official distributor product page,2026-04-01T00:00:00.000Z,,Added from 4C Labs public TGOD product page,,,,,,,
